{
  "case_id": "EXAMPLE-001",
  "media_type": "video",
  "input_hash": "<sha256>",
  "quality": {
    "quality_score": 0.62,
    "factors": [
      "moderate_compression"
    ],
    "artifact_density": 0.6,
    "artifact_count": 18
  },
  "signals": [
    {
      "id": "video_lip_sync_drift",
      "category": "cross_modal",
      "strength": 0.78,
      "description": "Audio phoneme timing inconsistent with mouth motion across sampled frames.",
      "false_positive_risks": [
        "dubbed audio",
        "broadcast latency"
      ]
    },
    {
      "id": "video_temporal_jitter",
      "category": "video",
      "strength": 0.55,
      "description": "Face region exhibits frame-to-frame instability inconsistent with camera motion.",
      "false_positive_risks": [
        "rolling shutter",
        "stabilization artifacts"
      ]
    }
  ],
  "provenance": {
    "metadata_present": true,
    "reencoding_detected": "unknown",
    "capture_signature": "absent",
    "tamper_evidence": "unknown"
  },
  "aggregation": {
    "risk_score": 0.73,
    "traffic_light": "red",
    "thresholds": {
      "green_lt": 0.35,
      "red_gte": 0.7,
      "quality_min_green": 0.35,
      "quality_min_any": 0.2,
      "red_override_if_low_quality": 0.85
    }
  },
  "limits": [
    "Assessment is probabilistic; no ground-truth authenticity claim is made.",
    "Re-encoding and low light can reduce signal reliability."
  ],
  "optional_next_steps": [
    "If stakes are high, consider obtaining the original capture file or a signed source copy."
  ],
  "version": "signal-schema-v1.0",
  "governance": {
    "invariants": [
      "Artifact density affects signal availability and uncertainty, not outcome authority.",
      "Artifact density may adjust quality and confidence metrics but must never directly influence traffic-light thresholds or force an outcome."
    ]
  }
}